{
  "org_node_id": "on-commune",
  "parent_id": "on-district",
  "tier": 3,
  "tenant_binding": "tenant-acme",
  "boundary_kind": "internal",
  "status": "active",
  "labels": {
    "label_key": "org.node.commune"
  },
  "jurisdiction": {
    "residency_zone": "VN",
    "allowed_zones": [
      "VN"
    ]
  }
}
